{
  "$schema": "https://json-schema.org/draft/2020-12/schema",
  "$id": "https://schemas.codex-video-edit.invalid/source.schema.json",
  "title": "Immutable source media",
  "type": "object",
  "additionalProperties": false,
  "required": [
    "schema_version",
    "source_id",
    "kind",
    "original_path",
    "sha256",
    "size_bytes",
    "duration_us",
    "immutable",
    "streams"
  ],
  "properties": {
    "schema_version": {
      "type": "string",
      "const": "1.0"
    },
    "source_id": {
      "type": "string",
      "pattern": "^[A-Za-z0-9][A-Za-z0-9._-]{1,127}$"
    },
    "kind": {
      "enum": [
        "screen",
        "camera",
        "microphone",
        "system_audio",
        "imported_video",
        "imported_audio",
        "image"
      ]
    },
    "original_path": {
      "type": "string",
      "minLength": 1
    },
    "managed_path": {
      "type": [
        "string",
        "null"
      ]
    },
    "sha256": {
      "type": "string",
      "pattern": "^[a-f0-9]{64}$"
    },
    "size_bytes": {
      "type": "integer",
      "minimum": 0
    },
    "duration_us": {
      "type": "integer",
      "minimum": 0
    },
    "immutable": {
      "type": "boolean",
      "const": true
    },
    "created_at": {
      "type": "string",
      "pattern": "^\\d{4}-\\d{2}-\\d{2}T\\d{2}:\\d{2}:\\d{2}(?:\\.\\d+)?Z$"
    },
    "streams": {
      "type": "array",
      "items": {
        "type": "object",
        "additionalProperties": false,
        "required": [
          "index",
          "media_type",
          "codec"
        ],
        "properties": {
          "index": {
            "type": "integer",
            "minimum": 0
          },
          "media_type": {
            "enum": [
              "video",
              "audio",
              "subtitle",
              "data"
            ]
          },
          "codec": {
            "type": "string",
            "minLength": 1
          },
          "width": {
            "type": "integer",
            "minimum": 1
          },
          "height": {
            "type": "integer",
            "minimum": 1
          },
          "frame_rate": {
            "type": "object",
            "additionalProperties": false,
            "required": [
              "numerator",
              "denominator"
            ],
            "properties": {
              "numerator": {
                "type": "integer",
                "minimum": 1
              },
              "denominator": {
                "type": "integer",
                "minimum": 1
              }
            }
          },
          "sample_rate_hz": {
            "type": "integer",
            "minimum": 1
          },
          "channels": {
            "type": "integer",
            "minimum": 1
          }
        }
      },
      "minItems": 1
    },
    "warnings": {
      "type": "array",
      "items": {
        "type": "string",
        "maxLength": 500
      }
    }
  }
}
