{
  "schema_version": "1.0",
  "source_id": "source-screen-001",
  "kind": "screen",
  "original_path": "C:/Users/demo/Videos/capture-screen.mkv",
  "managed_path": "raw/source-screen-001.mkv",
  "sha256": "aaaaaaaaaaaaaaaaaaaaaaaaaaaaaaaaaaaaaaaaaaaaaaaaaaaaaaaaaaaaaaaa",
  "size_bytes": 24000000,
  "duration_us": 62000000,
  "immutable": true,
  "created_at": "2026-09-04T12:01:00Z",
  "streams": [
    {
      "index": 0,
      "media_type": "video",
      "codec": "h264",
      "width": 2560,
      "height": 1440,
      "frame_rate": {
        "numerator": 60,
        "denominator": 1
      }
    }
  ],
  "warnings": []
}
